{
  "manifest": {
    "version": "0.0.1",
    "createdDate": "2025-09-30T04:00:00+10:00",
    "lastModified": "2025-09-30T04:00:00+10:00",
    "description": "EMS Ontology Definition",
    "changes": [
      {
        "version": "0.0.1",
        "date": "2025-09-30T04:00:00+10:00",
        "description": "Initial definition with basic record types and relationships"
      }
    ]
  },

  "attributeTypes": [
    {
      "name": "FullName",
      "dataType": "string",
      "validationRules": [
        {
          "type": "length",
          "minLength": 2,
          "maxLength": 100,
          "errorMessage": "Full name must be between 2 and 100 characters"
        }
      ],
      "cardinality": {
        "min": 1,
        "max": null
      }
    },
    {
      "name": "RegistrationNumber",
      "dataType": "string",
      "validationRules": [
        {
          "type": "regex",
          "pattern": "^[A-Z]{2}\\d{4}$",
          "errorMessage": "Invalid registration format (expected XX1234)"
        }
      ],
      "cardinality": {
        "min": 0,
        "max": 1
      }
    }
  ],

  "recordTypes": [
    {
      "name": "Person",
      "baseType": "Person",
      "attributes": [
        "FullName",
        {
          "name": "DateOfBirth",
          "dataType": "date",
          "validationRules": [
            {
              "type": "length",
              "minLength": 10,
              "maxLength": 10,
              "errorMessage": "Date must be in YYYY-MM-DD format"
            }
          ],
          "cardinality": {
            "min": 1,
            "max": 1
          }
        }
      ],
      "relationships": [
        {
          "targetType": "Vehicle",
          "relationshipType": "Owns",
          "cardinality": {
            "min": 0,
            "max": null
          }
        }
      ]
    }
  ],

  "linkTypes": [
    {
      "name": "Owns",
      "sourceTypes": ["Person"],
      "targetTypes": ["Vehicle"],
      "bidirectional": false,
      "inverseName": "OwnedBy"
    }
  ]
}